{
  "$schema": "../schemas/macro-zone.schema.json",
  "schema_version": 1,
  "id": "population.macro-zones.paris-1000km",
  "status": "draft",
  "scope": {
    "center": "Paris",
    "radius_km": 1000,
    "rule": "Approximate functional zones intersecting the study circle; exact clipping is deferred until population assignment."
  },
  "zones": [
    {"id":"fr-ile-de-france","name":"Île-de-France","country":"FR","basis":"administrative_region"},
    {"id":"fr-normandie","name":"Normandie","country":"FR","basis":"administrative_region"},
    {"id":"fr-hauts-de-france","name":"Hauts-de-France","country":"FR","basis":"administrative_region"},
    {"id":"fr-grand-est","name":"Grand Est","country":"FR","basis":"administrative_region"},
    {"id":"fr-bourgogne-franche-comte","name":"Bourgogne-Franche-Comté","country":"FR","basis":"administrative_region"},
    {"id":"fr-centre-val-de-loire","name":"Centre-Val de Loire","country":"FR","basis":"administrative_region"},
    {"id":"fr-pays-de-la-loire","name":"Pays de la Loire","country":"FR","basis":"administrative_region"},
    {"id":"fr-bretagne","name":"Bretagne","country":"FR","basis":"administrative_region"},
    {"id":"fr-nouvelle-aquitaine","name":"Nouvelle-Aquitaine","country":"FR","basis":"administrative_region"},
    {"id":"fr-occitanie","name":"Occitanie","country":"FR","basis":"administrative_region"},
    {"id":"fr-auvergne-rhone-alpes","name":"Auvergne-Rhône-Alpes","country":"FR","basis":"administrative_region"},
    {"id":"fr-paca","name":"Provence-Alpes-Côte d’Azur","country":"FR","basis":"administrative_region"},
    {"id":"fr-corse","name":"Corse","country":"FR","basis":"administrative_region"},
    {"id":"be-brussels-flanders","name":"Bruxelles et Flandre centrale","country":"BE","basis":"functional_zone"},
    {"id":"be-wallonia","name":"Wallonie","country":"BE","basis":"functional_zone"},
    {"id":"be-flanders-west","name":"Flandre occidentale et orientale","country":"BE","basis":"functional_zone"},
    {"id":"lu-all","name":"Luxembourg","country":"LU","basis":"country_unit"},
    {"id":"nl-south-west","name":"Pays-Bas méridionaux et occidentaux","country":"NL","basis":"functional_zone"},
    {"id":"nl-east-north","name":"Pays-Bas orientaux et septentrionaux","country":"NL","basis":"functional_zone"},
    {"id":"de-north-rhine","name":"Rhénanie-du-Nord-Westphalie","country":"DE","basis":"administrative_region"},
    {"id":"de-west","name":"Rhénanie-Palatinat et Sarre","country":"DE","basis":"functional_zone"},
    {"id":"de-central","name":"Hesse et Thuringe","country":"DE","basis":"functional_zone"},
    {"id":"de-south-west","name":"Bade-Wurtemberg","country":"DE","basis":"administrative_region"},
    {"id":"de-south-east","name":"Bavière","country":"DE","basis":"administrative_region"},
    {"id":"ch-west","name":"Suisse occidentale","country":"CH","basis":"functional_zone"},
    {"id":"ch-north-central","name":"Plateau suisse et Suisse centrale","country":"CH","basis":"functional_zone"},
    {"id":"ch-east-south","name":"Suisse orientale et méridionale","country":"CH","basis":"functional_zone"},
    {"id":"uk-london-south-east","name":"Londres et Sud-Est anglais","country":"UK","basis":"functional_zone"},
    {"id":"uk-midlands-wales","name":"Midlands et pays de Galles","country":"UK","basis":"functional_zone"},
    {"id":"uk-south-west","name":"Sud-Ouest anglais","country":"UK","basis":"functional_zone"},
    {"id":"es-north-east","name":"Catalogne et nord-est espagnol","country":"ES","basis":"functional_zone"},
    {"id":"es-north","name":"Pays basque, Navarre et nord espagnol","country":"ES","basis":"functional_zone"},
    {"id":"it-north-west","name":"Italie du Nord-Ouest","country":"IT","basis":"functional_zone"},
    {"id":"it-north-east","name":"Italie du Nord-Est","country":"IT","basis":"functional_zone"},
    {"id":"at-west","name":"Autriche occidentale","country":"AT","basis":"functional_zone"},
    {"id":"cz-west","name":"Bohême occidentale et Prague","country":"CZ","basis":"functional_zone"}
  ],
  "fields_to_collect": [
    "population_reference",
    "population_projection_factor",
    "settlement_class_shares",
    "urban_basin_anchors",
    "refuge_inventory",
    "preparedness_evidence",
    "transport_and_accessibility",
    "food_water_energy_constraints"
  ],
  "notes": "These are calculation units, not canonically defined political entities. Boundaries and inclusion must be checked against the exact 1,000 km circle before population totals are assigned."
}
